{
  "assessment": "INCONCLUSIVE",
  "authorized_instance": {
    "authorized_invocation_id": "r2a:06efaf441d6a50fdc2175594d15ef67eec2da86b5b6469ee336fff2deeca24f6",
    "local_id": "health-check-once"
  },
  "diagnostics": [
    {
      "code": "R2-G0-OCCURRENCE-EVIDENCE-INSUFFICIENT",
      "message": "Synthetic evidence intentionally cannot establish complete execution-occurrence accounting."
    }
  ],
  "evidence_status": "insufficient",
  "execution_attempt_id": "attempt-inconclusive",
  "execution_occurrences": [],
  "expected_execution_count": 1,
  "experiment_definition_sha256": "489e538c1a88525b2ce06ed2681cfc5e5110685e177cdaf2a59660144489d8f1",
  "format_version": "0.1-story",
  "kind": "orbitfabric.reference_mission.pwnsat_execution_observation",
  "observed_execution_count": null,
  "occurrence_criterion": {
    "id": "r2-g0.synthetic.accepted-occurrence",
    "synthetic": true,
    "version": "0.1"
  },
  "preconditions": {
    "identity_binding_valid": true,
    "reason": null
  },
  "presentations": [
    {
      "authorized_invocation_id": "r2a:06efaf441d6a50fdc2175594d15ef67eec2da86b5b6469ee336fff2deeca24f6",
      "id": "presentation-1"
    }
  ],
  "producer": {
    "id": "r2-g0-synthetic-observer",
    "version": "0.1"
  },
  "runtime": {
    "runtime_id": "synthetic-g0-no-external-runtime",
    "synthetic": true
  }
}
